"edge_type","region of brain","description","publication"
"Mathys no-pathology vs pathology up","...","",""
"Mathys no-pathology vs pathology down","...","",""
"Mathys no-pathology vs early-pathology up","...","",""
"Mathys no-pathology vs early-pathology down","...","",""
"Mathys early-pathology vs late-pathology up","...","",""
"Mathys early-pathology vs late-pathology down","...","",""
"AD vs NC lau up","","Genes upregulated in astrocytes in AD vs NC (normal controls) from Fig 2C","Lau et al 2020"
"AD vs NC lau down","...","","Lau et al 2020"
